Unnamed: 0.1,Unnamed: 0,Text,Sentiment,Timestamp,User,Platform,Hashtags,Retweets,Likes,Country,Year,Month,Day,Hour
0,0, Enjoying a beautiful day at the park!              , Positive  ,2023-01-15 12:30:00, User123      , Twitter  , #Nature #Park                            ,15.0,30.0,"Los Angeles, California, USA",2023,1,15,12
1,1, Traffic was terrible this morning.                 , Negative  ,2023-01-15 08:45:00, CommuterX    , Twitter  , #Traffic #Morning                        ,5.0,10.0,"Vancouver, British Columbia, Canada",2023,1,15,8
2,2, Just finished an amazing workout! 💪               , Positive  ,2023-01-15 15:45:00, FitnessFan   , Instagram , #Fitness #Workout                        ,20.0,40.0,"New York, New York, USA",2023,1,15,15
3,3, Excited about the upcoming weekend getaway!        , Positive  ,2023-01-15 18:20:00, AdventureX   , Facebook , #Travel #Adventure                       ,8.0,15.0,"London, England, UK",2023,1,15,18
4,4, Trying out a new recipe for dinner tonight.        , Neutral   ,2023-01-15 19:55:00, ChefCook     , Instagram , #Cooking #Food                           ,12.0,25.0,"Brisbane, QLD, Australia",2023,1,15,19
5,5, Feeling grateful for the little things in life.    , Positive  ,2023-01-16 09:10:00, GratitudeNow , Twitter  , #Gratitude #PositiveVibes              ,25.0,50.0,"Kolkata, West Bengal, India",2023,1,16,9
6,6, Rainy days call for cozy blankets and hot cocoa.   , Positive  ,2023-01-16 14:45:00, RainyDays    , Facebook , #RainyDays #Cozy                         ,10.0,20.0,"Montreal, Quebec, Canada",2023,1,16,14
7,7, The new movie release is a must-watch!             , Positive  ,2023-01-16 19:30:00, MovieBuff    , Instagram , #MovieNight #MustWatch                  ,15.0,30.0,"Los Angeles, California, USA",2023,1,16,19
8,8, Political discussions heating up on the timeline.  , Negative  ,2023-01-17 08:00:00, DebateTalk   , Twitter  , #Politics #Debate                       ,30.0,60.0,"New York, New York, USA",2023,1,17,8
9,9, Missing summer vibes and beach days.               , Neutral   ,2023-01-17 12:20:00, BeachLover   , Facebook , #Summer #BeachDays                      ,18.0,35.0,"Melbourne, VIC, Australia",2023,1,17,12
10,10, Just published a new blog post. Check it out!      , Positive  ,2023-01-17 15:15:00, BloggerX     , Instagram , #Blogging #NewPost                      ,22.0,45.0,"Chicago, Illinois, USA",2023,1,17,15
11,11, Feeling a bit under the weather today.             , Negative  ,2023-01-18 10:30:00, WellnessCheck, Twitter  , #SickDay #Health                        ,7.0,15.0,"Vancouver, British Columbia, Canada",2023,1,18,10
12,12, Exploring the city's hidden gems.                  , Positive  ,2023-01-18 14:50:00, UrbanExplorer, Facebook , #CityExplore #HiddenGems                ,12.0,25.0,"London, England, UK",2023,1,18,14
13,13," New year, new fitness goals! 💪                    ", Positive  ,2023-01-18 18:00:00, FitJourney   , Instagram , #NewYear #FitnessGoals                  ,28.0,55.0,"New York, New York, USA",2023,1,18,18
14,14, Technology is changing the way we live.            , Neutral   ,2023-01-19 09:45:00, TechEnthusiast, Twitter  , #Tech #Innovation                       ,15.0,30.0,"Mumbai, Maharashtra, India",2023,1,19,9
15,15, Reflecting on the past and looking ahead.          , Positive  ,2023-01-19 13:20:00, Reflections  , Facebook , #Reflection #Future                     ,20.0,40.0,"Chicago, Illinois, USA",2023,1,19,13
16,16, Just adopted a cute furry friend! 🐾              , Positive  ,2023-01-19 17:10:00, PetAdopter   , Instagram , #PetAdoption #FurryFriend               ,15.0,30.0,"Toronto, Ontario, Canada",2023,1,19,17
17,17, Late-night gaming session with friends.            , Positive  ,2023-01-20 00:05:00, GamerX       , Twitter  , #Gaming #LateNight                      ,18.0,35.0,"Manchester, England, UK",2023,1,20,0
18,18, Attending a virtual conference on AI.              , Neutral   ,2023-01-20 11:30:00, TechConference, Facebook , #AI #TechConference                     ,25.0,50.0,"Chicago, Illinois, USA",2023,1,20,11
19,19, Winter blues got me feeling low.                   , Negative  ,2023-01-20 15:15:00, WinterBlues  , Instagram , #WinterBlues #Mood                      ,8.0,15.0,"Chicago, Illinois, USA",2023,1,20,15
20,20, Sipping coffee and enjoying a good book.           , Positive  ,2023-01-21 08:40:00, Bookworm     , Twitter  , #Reading #CoffeeTime                    ,22.0,45.0,"Hyderabad, Telangana, India",2023,1,21,8
21,21, Exploring the world of virtual reality.            , Positive  ,2023-01-21 13:20:00, VRExplorer   , Facebook , #VR #VirtualReality                     ,15.0,30.0,"Los Angeles, California, USA",2023,1,21,13
22,22, Productive day ticking off my to-do list.          , Positive  ,2023-01-21 16:45:00, ProductivityPro, Instagram , #Productivity #WorkFromHome           ,30.0,60.0,"Los Angeles, California, USA",2023,1,21,16
23,23, Just finished a challenging workout routine.       , Positive  ,2023-01-22 09:15:00, FitnessWarrior, Twitter  , #Fitness #ChallengeAccepted             ,20.0,40.0,"Manchester, England, UK",2023,1,22,9
24,24, Celebrating a milestone at work! 🎉               , Positive  ,2023-01-22 14:30:00, CareerMilestone, Facebook , #Career #Milestone                      ,12.0,25.0,"Vancouver, British Columbia, Canada",2023,1,22,14
25,25, Sunday brunch with friends.                        , Positive  ,2023-01-22 12:00:00, BrunchBuddy  , Instagram , #Brunch #Friends                       ,15.0,30.0,"Manchester, England, UK",2023,1,22,12
26,26, Learning a new language for personal growth.       , Positive  ,2023-01-23 16:20:00, LanguageLearner, Facebook , #LanguageLearning #PersonalGrowth       ,25.0,50.0,"Delhi, Delhi, India",2023,1,23,16
27,27, Quiet evening with a good book.                    , Positive  ,2023-01-23 19:45:00, BookLover    , Instagram , #Reading #QuietTime                     ,15.0,30.0,"Brisbane, QLD, Australia",2023,1,23,19
28,28, Reflecting on the importance of mental health.     , Positive  ,2023-01-24 11:30:00, MentalHealthMatters, Twitter  , #MentalHealth #SelfCare                 ,22.0,45.0,"Los Angeles, California, USA",2023,1,24,11
29,29, New painting in progress! 🎨                       , Positive  ,2023-01-24 15:00:00, ArtistInAction, Facebook , #Art #PaintingInProgress             ,12.0,25.0,"Montreal, Quebec, Canada",2023,1,24,15
30,30, Weekend road trip to explore scenic views.         , Positive  ,2023-01-24 17:30:00, RoadTripper  , Instagram , #RoadTrip #ScenicViews                  ,18.0,35.0,"Birmingham, England, UK",2023,1,24,17
31,31, Enjoying a cup of tea and watching the sunset.     , Positive  ,2023-01-25 18:00:00, SunsetWatcher, Twitter  , #TeaTime #Sunset                       ,15.0,30.0,"Delhi, Delhi, India",2023,1,25,18
32,32, Coding a new project with enthusiasm.              , Positive  ,2023-01-25 13:15:00, CodeEnthusiast, Facebook , #Coding #Enthusiasm                   ,30.0,60.0,"Chicago, Illinois, USA",2023,1,25,13
33,33, Feeling inspired after attending a workshop.       , Positive  ,2023-01-26 09:45:00, WorkshopAttendee, Instagram , #Inspiration #Workshop                  ,25.0,50.0,"Los Angeles, California, USA",2023,1,26,9
34,34, Winter sports day at the local park.               , Positive  ,2023-01-26 14:20:00, WinterSports  , Twitter  , #WinterSports #Fun                     ,15.0,30.0,"Vancouver, British Columbia, Canada",2023,1,26,14
35,35, Quality time with family this weekend.             , Positive  ,2023-01-26 17:40:00, FamilyTime   , Facebook , #FamilyTime #Weekend                    ,22.0,45.0,"Birmingham, England, UK",2023,1,26,17
36,36, Attending a live music concert tonight.            , Positive  ,2023-01-27 20:00:00, MusicLover   , Instagram , #Music #ConcertNight                  ,18.0,35.0,"New York, New York, USA",2023,1,27,20
37,37, Practicing mindfulness with meditation.            , Positive  ,2023-01-27 12:30:00, MindfulMoments, Twitter  , #Mindfulness #Meditation               ,15.0,30.0,"Delhi, Delhi, India",2023,1,27,12
38,38, Trying out a new dessert recipe.                   , Positive  ,2023-01-27 16:10:00, DessertExplorer, Facebook , #Dessert #Cooking                      ,12.0,25.0,"Toronto, Ontario, Canada",2023,1,27,16
39,39, Excited about the upcoming gaming tournament.      , Positive  ,2023-01-28 09:00:00, GamingEnthusiast, Instagram , #Gaming #Tournament                     ,30.0,60.0,"Los Angeles, California, USA",2023,1,28,9
40,40, Planning a garden makeover for spring.             , Positive  ,2023-01-28 14:45:00, GardenPlanner , Twitter  , #Gardening #Spring                     ,25.0,50.0,"Los Angeles, California, USA",2023,1,28,14
41,41, Celebrating a friend's birthday tonight! 🎂       , Positive  ,2023-01-28 19:30:00, BirthdayBash , Facebook , #Birthday #Celebration                  ,15.0,30.0,"Birmingham, England, UK",2023,1,28,19
42,42, Feeling accomplished after a productive day.       , Positive  ,2023-01-29 17:00:00, ProductivityWin, Instagram , #Accomplished #Success               ,22.0,45.0,"Bengaluru, Karnataka, India",2023,1,29,17
43,43, A cozy evening with a good movie.                 , Positive  ,2023-01-29 20:20:00, MovieNight   , Twitter  , #CozyNight #MovieTime                   ,18.0,35.0,"Montreal, Quebec, Canada",2023,1,29,20
44,44, Exploring local art galleries this weekend.        , Positive  ,2023-01-30 11:30:00, ArtExplorer  , Facebook , #Art #GalleryExplore                    ,15.0,30.0,"Los Angeles, California, USA",2023,1,30,11
45,45, New book release from my favorite author!          , Positive  ,2023-01-30 15:45:00, BookwormX    , Instagram , #BookRelease #FavoriteAuthor           ,12.0,25.0,"Birmingham, England, UK",2023,1,30,15
46,46, Attending a virtual reality meetup.                , Positive  ,2023-01-30 18:30:00, VRMeetup     , Twitter  , #VRMeetup #VirtualReality               ,28.0,55.0,"Kolkata, West Bengal, India",2023,1,30,18
47,47, Reflecting on the beauty of nature.                , Positive  ,2023-01-31 10:45:00, NatureLover  , Facebook , #Nature #Reflection                     ,15.0,30.0,"Sydney, NSW, Australia",2023,1,31,10
48,48, Cooking a special dinner for loved ones.           , Positive  ,2023-01-31 19:00:00, ChefAtHome   , Instagram , #Cooking #SpecialDinner                ,20.0,40.0,"New York, New York, USA",2023,1,31,19
49,49, Feeling optimistic about the week ahead.           , Positive  ,2023-01-31 16:20:00, OptimisticMindset, Twitter  , #Optimism #NewWeek                     ,15.0,30.0,"Toronto, Ontario, Canada",2023,1,31,16
50,50, Starting a new fitness challenge tomorrow! 💪     , Positive  ,2023-02-01 08:00:00, FitnessChallenge, Facebook , #FitnessChallenge #NewBeginnings       ,22.0,45.0,"Manchester, England, UK",2023,2,1,8
51,51, Sunday bike ride through scenic trails.           , Positive  ,2023-02-01 13:30:00, BikeExplorer  , Instagram , #BikeRide #ScenicTrails                ,18.0,35.0,"Chicago, Illinois, USA",2023,2,1,13
52,52, Can't believe the injustice happening in our society., Anger        ,2023-02-11 09:30:00, SocialJustice   , Twitter  , #Injustice #Angry                            ,20.0,40.0,"Montreal, Quebec, Canada",2023,2,11,9
53,53, Feeling a sense of fear after watching a thriller movie. , Fear         ,2023-02-11 21:15:00, ThrillerFan     , Instagram , #Fear #ThrillerMovie                         ,15.0,30.0,"Chicago, Illinois, USA",2023,2,11,21
54,54, Heartbroken after hearing the news about a natural disaster. , Sadness      ,2023-02-12 14:45:00, EmpathyFirst    , Facebook , #Sadness #NaturalDisaster                    ,25.0,50.0,"Kolkata, West Bengal, India",2023,2,12,14
55,55, The state of the world's environment is just disgusting. , Disgust      ,2023-02-12 18:20:00, EcoAwareness    , Twitter  , #Disgust #Environment                        ,18.0,35.0,"Birmingham, England, UK",2023,2,12,18
56,56, Pure happiness: celebrating a loved one's achievement! , Happiness    ,2023-02-13 10:00:00, ProudFriend     , Instagram , #Happiness #Celebration                   ,30.0,60.0,"Los Angeles, California, USA",2023,2,13,10
57,57, Laughter is the best medicine—enjoying a comedy show. , Joy          ,2023-02-13 19:30:00, ComedyFan       , Facebook , #Joy #ComedyShow                             ,22.0,45.0,"Toronto, Ontario, Canada",2023,2,13,19
58,58, Sharing love and positive vibes with everyone! ❤️      , Love         ,2023-02-14 08:30:00, LoveSpreader    , Twitter  , #Love #SpreadLove                            ,15.0,30.0,"Melbourne, VIC, Australia",2023,2,14,8
59,59, An amusing incident brightened up my day!               , Amusement    ,2023-02-14 14:20:00, AmusedSoul      , Instagram , #Amusement #FunTimes                         ,18.0,35.0,"London, England, UK",2023,2,14,14
60,60, Enjoying a quiet evening with a book and some tea.      , Enjoyment    ,2023-02-14 19:45:00, BookLoverAgain  , Facebook , #Enjoyment #BookTime                         ,25.0,50.0,"Vancouver, British Columbia, Canada",2023,2,14,19
61,61, Admiring the beauty of nature during a peaceful hike.   , Admiration   ,2023-02-15 11:30:00, NatureAdmirer   , Twitter  , #Admiration #Nature                         ,20.0,40.0,"New York, New York, USA",2023,2,15,11
62,62, Sending affectionate vibes to all my followers!          , Affection    ,2023-02-15 16:00:00, AffectionSender , Instagram , #Affection #PositiveVibes                   ,15.0,30.0,"New York, New York, USA",2023,2,15,16
63,63, Experiencing awe at the breathtaking sunset.            , Awe          ,2023-02-15 20:30:00, AweStruck       , Facebook , #Awe #Breathtaking                          ,22.0,45.0,"Melbourne, VIC, Australia",2023,2,15,20
64,64, Disappointed with the service at a local restaurant.    , Disappointed ,2023-02-16 09:00:00, FoodieGoneWrong , Twitter  , #Disappointed #BadService                   ,18.0,35.0,"Hyderabad, Telangana, India",2023,2,16,9
65,65, A surprise gift from a friend made my day!              , Surprise     ,2023-02-16 14:45:00, HappySurprise   , Instagram , #Surprise #Gift                              ,25.0,50.0,"Los Angeles, California, USA",2023,2,16,14
66,66, Finding acceptance in the midst of life's challenges.   , Acceptance   ,2023-02-16 18:20:00, AcceptanceSeeker, Facebook , #Acceptance #Challenges                     ,15.0,30.0,"Montreal, Quebec, Canada",2023,2,16,18
67,67, Overflowing with adoration for my adorable pet! 🐾      , Adoration    ,2023-02-17 10:45:00, PetAdorer       , Twitter  , #Adoration #PetLove                         ,22.0,45.0,"Manchester, England, UK",2023,2,17,10
68,68, Anticipating a thrilling adventure in the coming weeks. , Anticipation ,2023-02-17 07:30:00, AdventureAwaits  , Instagram , #Anticipation #Adventure                    ,20.0,40.0,"Los Angeles, California, USA",2023,2,17,7
69,69, A bitter experience turned into a valuable lesson.      , Bitter       ,2023-02-17 15:00:00, LearnFromBitter , Facebook , #BitterLesson #Growth                      ,18.0,35.0,"Chicago, Illinois, USA",2023,2,17,15
70,70, Finding calmness in the midst of a busy day.            , Calmness     ,2023-02-18 09:30:00, ZenMaster       , Twitter  , #Calmness #PeacefulMind                    ,15.0,30.0,"Chennai, Tamil Nadu, India",2023,2,18,9
71,71, Confusion clouds my mind as I navigate through decisions., Confusion    ,2023-02-18 14:20:00, ConfusedMind    , Instagram , #Confusion #DecisionMaking                 ,25.0,50.0,"Birmingham, England, UK",2023,2,18,14
72,72, Excitement building up for the upcoming vacation!       , Excitement   ,2023-02-18 18:45:00, VacationDreamer , Facebook , #Excitement #TravelPlans                   ,22.0,45.0,"Toronto, Ontario, Canada",2023,2,18,18
73,73, Kindness witnessed today restored my faith in humanity. , Kind         ,2023-02-19 11:30:00, KindnessPrevails, Twitter  , #Kindness #Humanity                        ,20.0,40.0,"Los Angeles, California, USA",2023,2,19,11
74,74, Pride in achieving a personal milestone.               , Pride        ,2023-02-19 16:00:00, PersonalAchiever, Instagram , #Pride #Milestone                           ,30.0,60.0,"Brisbane, QLD, Australia",2023,2,19,16
75,75, A moment of shame for not standing up against injustice. , Shame        ,2023-02-19 19:45:00, ReflectiveSelf  , Facebook , #Shame #Injustice                           ,15.0,30.0,"Delhi, Delhi, India",2023,2,19,19
76,76, Fuming with anger after a heated argument.            , Anger        ,2023-02-20 09:30:00, AngryDebater    , Twitter  , #Anger #Argument                             ,20.0,40.0,"Vancouver, British Columbia, Canada",2023,2,20,9
77,77, The fear of the unknown is keeping me up at night.    , Fear         ,2023-02-20 21:15:00, FearfulDreamer  , Instagram , #Fear #Unknown                               ,15.0,30.0,"Los Angeles, California, USA",2023,2,20,21
78,78, Heartfelt sadness after bidding farewell to a dear friend. , Sadness      ,2023-02-21 14:45:00, FarewellHeart   , Facebook , #Sadness #Farewell                          ,25.0,50.0,"Delhi, Delhi, India",2023,2,21,14
79,79, The state of corruption in our society is utterly disgusting. , Disgust      ,2023-02-21 18:20:00, AntiCorruption  , Twitter  , #Disgust #Corruption                         ,18.0,35.0,"Birmingham, England, UK",2023,2,21,18
80,80, Overflowing happiness: welcoming a new family member!  , Happiness    ,2023-02-22 10:00:00, NewParentJoy    , Instagram , #Happiness #NewFamilyMember                 ,30.0,60.0,"London, England, UK",2023,2,22,10
81,81, Laughter is the key to joy—attending a stand-up comedy show. , Joy          ,2023-02-22 19:30:00, StandUpFan      , Facebook , #Joy #StandUpComedy                         ,22.0,45.0,"Toronto, Ontario, Canada",2023,2,22,19
82,82, Sending love to all my followers on this beautiful day! ❤️ , Love         ,2023-02-23 08:30:00, LoveSender      , Twitter  , #Love #SpreadLove                            ,15.0,30.0,"Sydney, NSW, Australia",2023,2,23,8
83,83, Amused by the antics of my pet—it's pure amusement!      , Amusement    ,2023-02-23 14:20:00, PetAmuser       , Instagram , #Amusement #PetAntics                       ,18.0,35.0,"London, England, UK",2023,2,23,14
84,84, Enjoying every moment of this trip—pure enjoyment!      , Enjoyment    ,2023-02-23 19:45:00, TravelExplorer  , Facebook , #Enjoyment #Travel                           ,25.0,50.0,"Los Angeles, California, USA",2023,2,23,19
85,85, Admiring the dedication of volunteers at a local charity. , Admiration   ,2023-02-24 11:30:00, CharityAdmirer  , Twitter  , #Admiration #Volunteers                     ,20.0,40.0,"Chicago, Illinois, USA",2023,2,24,11
86,86, Sending affectionate vibes to friends and family.        , Affection    ,2023-02-24 16:00:00, FamilyLover     , Instagram , #Affection #FamilyLove                      ,15.0,30.0,"Chicago, Illinois, USA",2023,2,24,16
87,87, Awe-struck by the beauty of the night sky.               , Awe          ,2023-02-24 20:30:00, Stargazer       , Facebook , #Awe #StarryNight                        ,22.0,45.0,"Brisbane, QLD, Australia",2023,2,24,20
88,88, Disappointed with the lack of progress in a personal project. , Disappointed ,2023-02-25 09:00:00, ProjectStruggle , Twitter  , #Disappointed #Project                     ,18.0,35.0,"Delhi, Delhi, India",2023,2,25,9
89,89, A surprise visit from an old friend brought tears of joy. , Surprise     ,2023-02-25 14:45:00, JoyfulReunion   , Instagram , #Surprise #OldFriends                       ,25.0,50.0,"Chicago, Illinois, USA",2023,2,25,14
90,90, Embracing acceptance of life's ups and downs.           , Acceptance   ,2023-02-25 18:20:00, LifeAcceptance  , Facebook , #Acceptance #LifeJourney                   ,15.0,30.0,"Toronto, Ontario, Canada",2023,2,25,18
91,91, Overflowing adoration for a cute rescue puppy! 🐶       , Adoration    ,2023-02-26 10:45:00, PuppyAdmirer    , Twitter  , #Adoration #PuppyLove                       ,22.0,45.0,"London, England, UK",2023,2,26,10
92,92, Anticipating the release of a much-awaited movie.       , Anticipation ,2023-02-26 07:30:00, MovieBuff2      , Instagram , #Anticipation #MovieRelease                 ,20.0,40.0,"Melbourne, VIC, Australia",2023,2,26,7
93,93, Bitter experience at the customer service department.   , Bitter       ,2023-02-26 15:00:00, CustomerWoes    , Facebook , #BitterExperience #CustomerService         ,18.0,35.0,"Chicago, Illinois, USA",2023,2,26,15
94,94, Finding calmness amidst the chaos of daily life.        , Calmness     ,2023-02-27 09:30:00, CalmSoul        , Twitter  , #Calmness #InnerPeace                      ,15.0,30.0,"Hyderabad, Telangana, India",2023,2,27,9
95,95, Confusion reigns as I try to make sense of recent events., Confusion    ,2023-02-27 14:20:00, ConfusedMind2   , Instagram , #Confusion #MakingSense                    ,25.0,50.0,"London, England, UK",2023,2,27,14
96,96, Excitement building up for a surprise birthday party.   , Excitement   ,2023-02-27 18:45:00, BirthdayExcite  , Facebook , #Excitement #SurpriseParty                 ,22.0,45.0,"Toronto, Ontario, Canada",2023,2,27,18
97,97, Witnessed an act of kindness that made my day.          , Kind         ,2023-02-28 11:30:00, KindnessObserver, Twitter  , #Kindness #ActsOfKindness                  ,20.0,40.0,"Chicago, Illinois, USA",2023,2,28,11
98,98, Pride in completing a challenging fitness challenge.    , Pride        ,2023-02-28 16:00:00, FitAchiever     , Instagram , #Pride #FitnessChallengeCompleted          ,30.0,60.0,"Manchester, England, UK",2023,2,28,16
99,99, A moment of shame for not speaking up against injustice., Shame        ,2023-02-28 19:45:00, ReflectiveSelf2 , Facebook , #Shame #Injustice                           ,15.0,30.0,"Chennai, Tamil Nadu, India",2023,2,28,19
100,100, Reflecting on the beauty of diversity in our world.     , Acceptance   ,2023-03-01 10:45:00, DiversityLover  , Twitter  , #Acceptance #Diversity                      ,22.0,45.0,"Sydney, NSW, Australia",2023,3,1,10
101,101, Excitement for a quiet evening with a good book.        , Excitement   ,2023-03-01 13:30:00, BookwormJoy     , Instagram , #Excitement #BookTime                       ,18.0,35.0,"New York, New York, USA",2023,3,1,13
102,102, Feeling bitter about the unfairness in the workplace.   , Bitter       ,2023-03-01 17:45:00, WorkplaceWoes   , Twitter  , #Bitter #Unfairness                         ,15.0,30.0,"Toronto, Ontario, Canada",2023,3,1,17
103,103, Calmness prevails as I practice mindfulness.            , Calmness     ,2023-03-02 18:00:00, MindfulMe       , Facebook , #Calmness #Mindfulness                      ,15.0,30.0,"Manchester, England, UK",2023,3,2,18
104,104, Confusion surrounds me as I navigate through life's choices. , Confusion ,2023-03-02 13:15:00, ConfusedMind3   , Instagram , #Confusion #LifeChoices                     ,30.0,60.0,"New York, New York, USA",2023,3,2,13
105,105, Excitement for a weekend road trip to explore new places. , Excitement ,2023-03-02 16:45:00, RoadTripper2    , Twitter  , #Excitement #WeekendAdventure               ,25.0,50.0,"Delhi, Delhi, India",2023,3,2,16
106,106, Kindness witnessed today restores my faith in humanity.  , Kind         ,2023-03-03 11:30:00, KindnessPrevails2, Facebook , #Kindness #HumanityRestored                 ,22.0,45.0,"Los Angeles, California, USA",2023,3,3,11
107,107, Pride in accomplishing personal and professional goals.  , Pride        ,2023-03-03 14:30:00, GoalAchiever    , Instagram , #Pride #Accomplishments                     ,12.0,25.0,"Vancouver, British Columbia, Canada",2023,3,3,14
108,108, Shame for not being true to my values in a difficult situation., Shame ,2023-03-03 12:00:00, ReflectiveSelf3 , Twitter  , #Shame #Integrity                           ,15.0,30.0,"London, England, UK",2023,3,3,12
109,109," Revisiting old memories, feeling a sense of elation. ", Elation       ,2010-05-15 15:30:00, NostalgiaFan    , Twitter  , #Elation #Memories                             ,20.0,40.0,"Toronto, Ontario, Canada",2010,5,15,15
110,110, The victory of our team brought euphoria to the city. , Euphoria      ,2021-08-10 21:15:00, SportsFanatic   , Instagram , #Euphoria #Victory                             ,15.0,30.0,"Los Angeles, California, USA",2021,8,10,21
111,111," Embracing the beauty of nature, a moment of contentment. ", Contentment   ,2011-06-20 14:45:00, NatureLover2    , Facebook , #Contentment #Nature                           ,25.0,50.0,"Mumbai, Maharashtra, India",2011,6,20,14
112,112," Meditating by the serene lake, finding inner peace.   ", Serenity      ,2022-02-12 18:20:00, ZenMaster2      , Twitter  , #Serenity #Meditation                          ,18.0,35.0,"London, England, UK",2022,2,12,18
113,113, Overflowing with gratitude for life's blessings.      , Gratitude     ,2012-11-25 10:00:00, ThankfulHeart   , Instagram , #Gratitude #Blessed                            ,30.0,60.0,"Brisbane, QLD, Australia",2012,11,25,10
114,114," Hopeful for a brighter tomorrow, despite challenges.  ", Hope          ,2013-04-05 19:30:00, OptimisticSoul  , Facebook , #Hope #Optimism                                ,22.0,45.0,"New York, New York, USA",2013,4,5,19
115,115, Empowered to make a difference in my community.        , Empowerment   ,2014-09-14 08:30:00, CommunityLeader , Twitter  , #Empowerment #Community                        ,15.0,30.0,"Birmingham, England, UK",2014,9,14,8
116,116, Compassion in action: supporting a local charity event. , Compassion    ,2015-07-18 14:20:00, CharitySupporter, Instagram , #Compassion #CharityEvent                   ,18.0,35.0,"Montreal, Quebec, Canada",2015,7,18,14
117,117," A moment of tenderness, connecting with loved ones.    ", Tenderness    ,2016-02-23 19:45:00, LovingHeart     , Facebook , #Tenderness #FamilyTime                       ,25.0,50.0,"London, England, UK",2016,2,23,19
