Unnamed: 0.1,Unnamed: 0,Text,Sentiment,Timestamp,User,Platform,Hashtags,Retweets,Likes,Country,Year,Month,Day,Hour
426,426,"Emotional storm, a whirlwind of sadness engulfs every thought.    ", EmotionalStorm ,2017-07-18 17:45:00, StormyFeelings  , Instagram , #EmotionalStorm #SadnessWhirlwind      ,30.0,60.0,"Bengaluru, Karnataka, India",2017,7,18,17
427,427,"Haunted by regrets, the ghost of the past lingers relentlessly.   ", Regret        ,2018-12-15 10:00:00, LingeringGhost  , Twitter  , #Regret #HauntedPast                    ,18.0,35.0,"UnknownCity, UnknownState, UnknownCountry",2018,12,15,10
428,428,"Torn apart by grief, the echoes of loss reverberate through the soul. ", Grief      ,2015-06-28 21:15:00, EchoesOfLoss    , Facebook , #Grief #TornApart                       ,28.0,55.0,"UnknownCity, UnknownState, UnknownCountry",2015,6,28,21
429,429,"Isolation deepens, an emotional winter where warmth is but a distant memory. ", Isolation ,2020-04-02 14:20:00, WinterOfEmotions , Instagram , #Isolation #EmotionalWinter            ,35.0,70.0,"UnknownCity, UnknownState, UnknownCountry",2020,4,2,14
430,430,"Soul-crushing disappointment, hopes shattered like fragile glass. ", Disappointment ,2019-10-08 18:30:00, ShatteredHopes  , Twitter  , #Disappointment #CrushedHopes          ,20.0,40.0,"UnknownCity, UnknownState, UnknownCountry",2019,10,8,18
431,431,"Painful echoes of a love once cherished, now lost in the abyss of time. ", LostLove ,2016-11-22 09:45:00, AbyssOfTime     , Facebook , #LostLove #PainfulEchoes               ,22.0,45.0,"UnknownCity, UnknownState, UnknownCountry",2016,11,22,9
432,432,"Heartache deepens, a solitary journey through the abyss of despair. ", Despair   ,2022-08-18 22:00:00, SolitaryDescent , Instagram , #Despair #AbyssOfHeartache             ,40.0,80.0,"UnknownCity, UnknownState, UnknownCountry",2022,8,18,22
433,433,"Melancholy lingers, a bittersweet serenade in the quietude of solitude. ", Melancholy ,2017-03-12 23:30:00, SerenadeOfSolitude , Twitter , #Melancholy #QuietSerenade             ,18.0,35.0,"London, England, UK",2017,3,12,23
434,434,"Bitterness like a poison, seeping into every crevice of the wounded heart. ", Bitterness ,2015-12-15 16:15:00, PoisonedHeart   , Facebook , #Bitterness #WoundedHeart              ,25.0,50.0,"Sydney, NSW, Australia",2015,12,15,16
435,435,"Emotional exhaustion, the weight of the world crushing weary shoulders. ", Exhaustion ,2021-09-05 13:30:00, WearySoulCrushed , Instagram , #Exhaustion #CrushedSpirit             ,35.0,70.0,"Montreal, Quebec, Canada",2021,9,5,13
436,436,"Sorrowful echoes, a symphony of pain played by the strings of loss. ", Sorrow      ,2018-05-22 20:45:00, StringsOfSorrow , Twitter  , #Sorrow #SymphonyOfLoss                ,18.0,35.0,"UnknownCity, UnknownState, UnknownCountry",2018,5,22,20
437,437,"Darkness descends, engulfing the soul in the shadows of despair.  ", Darkness     ,2016-07-10 18:20:00, SoulInShadow    , Facebook , #Darkness #SoulEngulfed                 ,28.0,55.0,"Chicago, Illinois, USA",2016,7,10,18
438,438,"Desperation whispers, the silent plea for a glimmer of hope in the abyss. ", Desperation ,2019-04-30 14:00:00, WhisperedDespair , Instagram , #Desperation #GlimmerOfHope            ,22.0,45.0,"UnknownCity, UnknownState, UnknownCountry",2019,4,30,14
439,439,"Heart in ruins, the remnants of shattered dreams scattered in the wind. ", Ruins      ,2022-01-08 11:30:00, DreamsInWind    , Twitter  , #Ruins #ShatteredDreams                ,20.0,40.0,"UnknownCity, UnknownState, UnknownCountry",2022,1,8,11
440,440,"Shattered by the echoes of a shattered dream, fragments of hope scattered. ", Desolation ,2017-09-10 19:15:00, DreamEchoes , Twitter , #Desolation #ScatteredHope ,20.0,40.0,"Melbourne, VIC, Australia",2017,9,10,19
441,441,"Avoiding the thorns of regret, walking barefoot on the path of remorse. ", Regret ,2022-04-18 11:30:00, RemorseWalker , Instagram , #Regret #PathOfRemorse ,25.0,50.0,"Vancouver, British Columbia, Canada",2022,4,18,11
442,442,"In the labyrinth of grief, the walls echo with the footsteps of lost joy. ", Grief ,2018-12-05 21:45:00, JoyLabyrinth , Facebook , #Grief #LostJoyFootsteps ,18.0,35.0,"New York, New York, USA",2018,12,5,21
443,443,"A soul adrift in the sea of solitude, waves of loneliness crashing relentlessly. ", Loneliness ,2016-06-28 14:20:00, SolitudeSeas , Twitter , #Loneliness #CrashingWaves ,22.0,45.0,"Birmingham, England, UK",2016,6,28,14
444,444,"The bitterness of betrayal, a taste that lingers, staining the palate of trust. ", Bitterness ,2019-10-22 17:00:00, PalateStainer , Instagram , #Bitterness #StainedTrust ,15.0,30.0,"UnknownCity, UnknownState, UnknownCountry",2019,10,22,17
445,445,"In the ruins of hope, echoes of shattered dreams whisper tales of loss. ", Desolation ,2021-03-15 22:45:00, HopeRuins , Facebook , #Desolation #WhisperedLoss ,28.0,55.0,"UnknownCity, UnknownState, UnknownCountry",2021,3,15,22
446,446,"Sinking like a stone in the ocean of heartbreak, each ripple a sigh of despair. ", Heartbreak ,2017-08-10 19:30:00, OceanSinker , Twitter , #Heartbreak #RippleOfDespair ,22.0,45.0,"UnknownCity, UnknownState, UnknownCountry",2017,8,10,19
447,447,"Tears, the ink staining the pages of a journal, a testament to silent grief. ", Grief ,2023-01-28 14:30:00, InkJournalist , Instagram , #Grief #SilentTears ,30.0,60.0,"Mumbai, Maharashtra, India",2023,1,28,14
448,448,"In the wasteland of lost trust, the echoes of broken promises reverberate. ", Betrayal ,2016-12-12 10:00:00, TrustWasteland , Facebook , #Betrayal #ReverberatingPromises ,25.0,50.0,"UnknownCity, UnknownState, UnknownCountry",2016,12,12,10
449,449,"Avoiding the shards of shattered dreams, walking the tightrope of resilience. ", Resilience ,2020-07-18 15:15:00, DreamTightrope , Twitter , #Resilience #TightropeWalk ,35.0,70.0,"UnknownCity, UnknownState, UnknownCountry",2020,7,18,15
450,450,"Suffocating in the silence of solitude, where echoes of laughter once thrived. ", Isolation ,2022-05-20 20:30:00, EchoedLaughter , Instagram , #Isolation #SilentSolitude ,30.0,60.0,"UnknownCity, UnknownState, UnknownCountry",2022,5,20,20
451,451,"Haunted by the specter of lost possibilities, a ghost that refuses to fade away. ", Regret ,2019-11-08 14:45:00, PossibilityGhost , Twitter , #Regret #FadingPossibilities ,18.0,35.0,"UnknownCity, UnknownState, UnknownCountry",2019,11,8,14
452,452,"In the labyrinth of despair, the echoes of a broken heart reverberate endlessly. ", Despair ,2017-03-28 22:00:00, EndlessLabyrinth , Facebook , #Despair #EndlessReverberation ,28.0,55.0,"Melbourne, VIC, Australia",2017,3,28,22
453,453,"Sinking like autumn leaves in the river of sorrow, carried away by the current. ", Sorrow ,2020-09-15 18:15:00, RiverOfSorrow , Instagram , #Sorrow #AutumnLeaves ,22.0,45.0,"Toronto, Ontario, Canada",2020,9,15,18
454,454,"In the garden of broken dreams, petals fall, a silent testimony to shattered hopes. ", Desolation ,2018-06-10 13:30:00, DreamGardener , Twitter , #Desolation #ShatteredHopes ,20.0,40.0,"London, England, UK",2018,6,10,13
455,455,"Tears, the currency of grief, spent in the marketplace of lost love and longing. ", Grief ,2016-12-22 21:45:00, CurrencyOfTears , Facebook , #Grief #LostLoveLonging ,25.0,50.0,"New York, New York, USA",2016,12,22,21
456,456,"Wandering in the maze of betrayal, the walls closing in with every wrong turn. ", Betrayal ,2021-01-05 16:20:00, MazeWanderer , Instagram , #Betrayal #ClosingWalls ,15.0,30.0,"UnknownCity, UnknownState, UnknownCountry",2021,1,5,16
457,457,"A soul weathered by the storm of heartbreak, seeking refuge in the calm after. ", Heartbreak ,2019-04-18 11:00:00, StormSeeker , Twitter , #Heartbreak #CalmAfterStorm ,22.0,45.0,"UnknownCity, UnknownState, UnknownCountry",2019,4,18,11
458,458,"In the tapestry of despair, threads of hope unravel, leaving a portrait of sorrow. ", Despair ,2017-08-28 19:30:00, TapestrySorrow , Facebook , #Despair #UnraveledHope ,18.0,35.0,"Bengaluru, Karnataka, India",2017,8,28,19
459,459,"Like a withered rose in the garden of love, petals fall, a silent surrender to time. ", Loss ,2023-02-10 14:30:00, WitheredRose , Instagram , #Loss #SilentSurrender ,28.0,55.0,"UnknownCity, UnknownState, UnknownCountry",2023,2,10,14
460,460,"In the void of heartache, echoes of a love song play, each note a pang of longing. ", Heartache ,2022-07-10 22:15:00, LoveSongEcho , Instagram , #Heartache #LoveSongLonging ,30.0,60.0,"UnknownCity, UnknownState, UnknownCountry",2022,7,10,22
461,461,"Nostalgia, a bittersweet dance in the moonlit ballroom of cherished memories. ", Nostalgia ,2019-05-15 21:30:00, MoonlitMemories , Twitter , #Nostalgia #CherishedMemories ,18.0,35.0,"UnknownCity, UnknownState, UnknownCountry",2019,5,15,21
462,462,"In the symphony of grief, each tear is a note, composing a melancholic melody. ", Grief ,2018-11-28 14:00:00, SymphonyOfTears , Facebook , #Grief #MelancholicMelody ,22.0,45.0,"UnknownCity, UnknownState, UnknownCountry",2018,11,28,14
463,463,"Betrayal, a venomous serpent slithering through the garden of trust, poisoning roots. ", Betrayal ,2021-03-02 17:45:00, VenomousGarden , Instagram , #Betrayal #PoisonedTrust ,25.0,50.0,"Vancouver, British Columbia, Canada",2021,3,2,17
464,464,"Sinking in the quicksand of despair, the harder you fight, the deeper you descend. ", Despair ,2016-10-18 19:30:00, QuicksandFighter , Twitter , #Despair #DeepDescent ,20.0,40.0,"New York, New York, USA",2016,10,18,19
465,465,"Wandering through the cemetery of lost dreams, tombstones marking untold sorrows. ", Desolation ,2020-08-15 12:30:00, DreamCemetery , Facebook , #Desolation #UntoldSorrows ,28.0,55.0,"UnknownCity, UnknownState, UnknownCountry",2020,8,15,12
466,466,"Swept away by the river of regret, the currents of the past refusing to release. ", Regret ,2017-04-28 16:20:00, RegretRiver , Instagram , #Regret #PastCurrents ,18.0,35.0,"Manchester, England, UK",2017,4,28,16
467,467,"Whispers of lost love linger in the attic of the heart, forgotten but not erased. ", Loss ,2019-09-10 21:00:00, HeartAttic , Twitter , #Loss #ForgottenLove ,22.0,45.0,"Sydney, NSW, Australia",2019,9,10,21
468,468,"In the gallery of broken promises, each shattered vow framed, a painful exhibition. ", Betrayal ,2022-01-28 13:45:00, PromiseGallery , Facebook , #Betrayal #ShatteredVows ,15.0,30.0,"UnknownCity, UnknownState, UnknownCountry",2022,1,28,13
469,469,"The echoes of solitude, a silent conversation between a soul and its shadows. ", Solitude ,2016-06-15 22:30:00, EchoedConversation , Instagram , #Solitude #ShadowConversation ,30.0,60.0,"UnknownCity, UnknownState, UnknownCountry",2016,6,15,22
470,470,"Dancing on sunshine, each step a celebration of the joy found in simple moments. ", Joy ,2021-08-20 15:45:00, SunshineDancer , Instagram , #Joy #SimpleMoments ,40.0,80.0,"Chicago, Illinois, USA",2021,8,20,15
471,471,"Laughter echoes in the air, a chorus of happiness that lifts the spirit higher. ", Happiness ,2018-04-12 18:30:00, EchoedLaughter , Twitter , #Happiness #SpiritLifter ,35.0,70.0,"Toronto, Ontario, Canada",2018,4,12,18
472,472,"In the garden of contentment, each bloom whispers tales of inner peace and joy. ", Contentment ,2022-02-15 12:20:00, GardenOfJoy , Facebook , #Contentment #InnerPeace ,25.0,50.0,"Manchester, England, UK",2022,2,15,12
473,473,"Chasing dreams under the vibrant sky, a journey fueled by hope and enthusiasm. ", Enthusiasm ,2019-10-28 14:15:00, DreamChaser , Instagram , #Enthusiasm #HopefulJourney ,30.0,60.0,"Melbourne, VIC, Australia",2019,10,28,14
474,474,"Serenading the stars with a heart full of gratitude, a melody of thankfulness. ", Gratitude ,2017-12-22 21:00:00, StarSerenader , Twitter , #Gratitude #ThankfulMelody ,22.0,45.0,"Bengaluru, Karnataka, India",2017,12,22,21
475,475,"Basking in the glow of accomplishment, each milestone a stepping stone to happiness. ", Accomplishment ,2020-06-10 17:30:00, GlowAchiever , Facebook , #Accomplishment #HappinessMilestone ,28.0,55.0,"UnknownCity, UnknownState, UnknownCountry",2020,6,10,17
476,476,"In the dance of positivity, every step is a rhythm, uplifting the soul in harmony. ", Positivity ,2016-09-18 19:45:00, DanceHarmony , Instagram , #Positivity #SoulUpliftment ,18.0,35.0,"UnknownCity, UnknownState, UnknownCountry",2016,9,18,19
477,477,"Overflowing with joy, a cup of laughter shared with friends, a moment cherished. ", Joy ,2023-03-10 14:30:00, LaughterCup , Twitter , #Joy #CherishedMoment ,20.0,40.0,"UnknownCity, UnknownState, UnknownCountry",2023,3,10,14
478,478,"Draped in the warmth of kindness, a quilt of compassion stitched with love. ", Kindness ,2019-05-05 12:15:00, QuiltedCompassion , Facebook , #Kindness #LoveStitches ,25.0,50.0,"UnknownCity, UnknownState, UnknownCountry",2019,5,5,12
479,479,"In the garden of friendships, each bloom a testament to the beauty of camaraderie. ", Friendship ,2018-08-28 16:00:00, FriendshipGarden , Instagram , #Friendship #CamaraderieBlooms ,30.0,60.0,"UnknownCity, UnknownState, UnknownCountry",2018,8,28,16
480,480,"In the embrace of love, each heartbeat is a melody, dancing to the rhythm of affection. ", Love ,2022-11-15 20:45:00, MelodyOfLove , Twitter , #Love #RhythmOfAffection ,35.0,70.0,"New York, New York, USA",2022,11,15,20
481,481,"Surrounded by the colors of joy, a canvas painted with laughter and endless smiles. ", Joy ,2019-07-02 17:00:00, ColorfulLaughter , Instagram , #Joy #EndlessSmiles ,40.0,80.0,"Montreal, Quebec, Canada",2019,7,2,17
482,482,"In the symphony of excitement, each note is a burst of energy, igniting the soul with fervor. ", Excitement ,2021-04-18 14:20:00, SymphonyFervor , Facebook , #Excitement #IgnitedSoul ,30.0,60.0,"Manchester, England, UK",2021,4,18,14
483,483,"A surprise gift, wrapped in anticipation, unfolds a moment of delight and wonder. ", Surprise ,2023-02-05 19:30:00, WrappedDelight , Twitter , #Surprise #WonderfulMoment ,25.0,50.0,"Sydney, NSW, Australia",2023,2,5,19
484,484,"Lost in the maze of curiosity, each twist and turn unveils the treasures of discovery. ", Curiosity ,2018-09-22 12:45:00, MazeDiscovery , Instagram , #Curiosity #TreasuresOfDiscovery ,22.0,45.0,"Kolkata, West Bengal, India",2018,9,22,12
485,485,"Floating on clouds of gratitude, each raindrop a blessing, a shower of thankfulness. ", Gratitude ,2016-12-10 21:15:00, CloudsOfBlessings , Facebook , #Gratitude #ShowerOfThankfulness ,28.0,55.0,"UnknownCity, UnknownState, UnknownCountry",2016,12,10,21
486,486,"Like a comet of inspiration, streaking through the sky of creativity, leaving trails of brilliance. ", Inspiration ,2020-05-28 16:00:00, CometCreativity , Twitter , #Inspiration #BrilliantTrails ,18.0,35.0,"UnknownCity, UnknownState, UnknownCountry",2020,5,28,16
487,487,"In the celebration of success, fireworks of accomplishment light up the night sky of triumph. ", Success ,2017-11-15 22:30:00, FireworksTriumph , Instagram , #Success #NightSkyTriumph ,22.0,45.0,"UnknownCity, UnknownState, UnknownCountry",2017,11,15,22
488,488,"A symphony of laughter, each note a key to unlocking the door of boundless happiness. ", Happiness ,2021-08-02 19:00:00, LaughterSymphony , Facebook , #Happiness #BoundlessLaughter ,30.0,60.0,"UnknownCity, UnknownState, UnknownCountry",2021,8,2,19
489,489,"In the carnival of emotions, the rollercoaster of thrill sends the heart on a wild ride. ", Thrill ,2019-03-28 15:30:00, EmotionCarnival , Instagram , #Thrill #WildHeartRide ,35.0,70.0,"UnknownCity, UnknownState, UnknownCountry",2019,3,28,15
490,490,"Standing before the grandeur of the Eiffel Tower, a moment to reflect on the beauty of Parisian dreams. ", Reflection ,2018-05-12 17:30:00, ParisDreamer , Twitter , #Reflection #ParisianDreams ,28.0,55.0,"UnknownCity, UnknownState, UnknownCountry",2018,5,12,17
491,491,"Lost in the enchantment of Disneyland, each ride a journey into the realm of childhood fantasies. ", Enchantment ,2022-09-28 15:45:00, DisneylandExplorer , Instagram , #Enchantment #ChildhoodFantasies ,30.0,60.0,"New York, New York, USA",2022,9,28,15
492,492,"Exploring the wonders of Ferrari World, the roar of engines creating a symphony of speed. ", Excitement ,2019-11-10 14:00:00, FerrariSpeedster , Facebook , #Excitement #SymphonyOfSpeed ,22.0,45.0,"UnknownCity, UnknownState, UnknownCountry",2019,11,10,14
493,493,"Amidst the tulip fields of Keukenhof, a tapestry of colors that paints the soul with springtime joy. ", Joy ,2021-04-02 18:20:00, KeukenhofAdventurer , Instagram , #Joy #SpringtimeColors ,35.0,70.0,"UnknownCity, UnknownState, UnknownCountry",2021,4,2,18
494,494,"Wandering through the historical streets of Kyoto, each step a journey into the heart of Japan's traditions. ", Exploration ,2017-08-22 21:30:00, KyotoAdventurer , Twitter , #Exploration #JapaneseTraditions ,18.0,35.0,"UnknownCity, UnknownState, UnknownCountry",2017,8,22,21
495,495,"In the embrace of the Grand Canyon, nature's masterpiece, a moment to marvel at Earth's grandeur. ", Awe ,2020-06-15 16:45:00, CanyonMarveler , Instagram , #Awe #EarthsGrandeur ,25.0,50.0,"Chicago, Illinois, USA",2020,6,15,16
496,496,"Journeying through the serenity of Santorini, where each sunset paints the sky with hues of tranquility. ", Serenity ,2016-09-10 19:15:00, SantoriniTraveler , Facebook , #Serenity #SunsetHues ,22.0,45.0,"UnknownCity, UnknownState, UnknownCountry",2016,9,10,19
497,497,"Amazed by the architectural marvels of Petra, each stone telling tales of an ancient civilization. ", Amazement ,2023-01-28 13:00:00, PetraExplorer , Twitter , #Amazement #AncientTales ,30.0,60.0,"UnknownCity, UnknownState, UnknownCountry",2023,1,28,13
498,498,"Embarking on a gondola ride in Venice, each canal reflecting the romance of this timeless city. ", Romance ,2019-04-18 16:30:00, VeniceRomantic , Instagram , #Romance #TimelessCity ,20.0,40.0,"UnknownCity, UnknownState, UnknownCountry",2019,4,18,16
499,499,"At the summit of Machu Picchu, a breathtaking panorama that whispers the secrets of ancient civilizations. ", Awe ,2017-11-05 22:00:00, MachuPicchuAdventurer , Facebook , #Awe #AncientCivilizations ,28.0,55.0,"UnknownCity, UnknownState, UnknownCountry",2017,11,5,22
500,500,"In the heart of New York City, Times Square dazzles with lights, a vibrant spectacle of urban energy. ", Excitement ,2022-07-20 21:45:00, TimesSquareExplorer , Instagram , #Excitement #UrbanEnergy ,35.0,70.0,"New York, New York, USA",2022,7,20,21
501,501,"Captivated by the historical charm of the Colosseum, each stone echoing tales of gladiator valor. ", Captivation ,2018-03-15 17:30:00, ColosseumAdventurer , Twitter , #Captivation #GladiatorTales ,25.0,50.0,"UnknownCity, UnknownState, UnknownCountry",2018,3,15,17
502,502,"Sailing the azure waters of the Maldives, each wave a whisper of serenity in paradise. ", Serenity ,2019-10-28 14:15:00, MaldivesSailor , Facebook , #Serenity #ParadiseWhispers ,22.0,45.0,"UnknownCity, UnknownState, UnknownCountry",2019,10,28,14
503,503,"In the midst of the Amazon rainforest, a symphony of wildlife creates an orchestra of nature's wonders. ", Wonder ,2021-06-10 16:00:00, AmazonExplorer , Instagram , #Wonder #NatureOrchestra ,30.0,60.0,"UnknownCity, UnknownState, UnknownCountry",2021,6,10,16
504,504,"Walking the Great Wall of China, each step a testament to ancient engineering marvels. ", Awe ,2017-08-18 19:30:00, GreatWallWalker , Twitter , #Awe #EngineeringMarvels ,18.0,35.0,"UnknownCity, UnknownState, UnknownCountry",2017,8,18,19
505,505,"At the summit of Mount Fuji, a breathtaking sunrise that paints the sky with hues of accomplishment. ", Accomplishment ,2020-04-15 05:30:00, FujiSummitAchiever , Facebook , #Accomplishment #SunriseHues ,28.0,55.0,"UnknownCity, UnknownState, UnknownCountry",2020,4,15,5
506,506,"Exploring the ancient ruins of Angkor Wat, each stone whispering stories of Khmer civilization. ", Exploration ,2016-11-22 13:00:00, AngkorWatAdventurer , Instagram , #Exploration #KhmerStories ,20.0,40.0,"UnknownCity, UnknownState, UnknownCountry",2016,11,22,13
507,507,"Skiing down the slopes of the Swiss Alps, each turn a dance with the majesty of snow-capped peaks. ", Adventure ,2019-01-10 14:45:00, AlpsSkiAdventurer , Twitter , #Adventure #SnowPeakDance ,22.0,45.0,"UnknownCity, UnknownState, UnknownCountry",2019,1,10,14
508,508,"In the tranquility of Kyoto's bamboo forest, whispers of ancient Zen wisdom echo through the groves. ", Tranquility ,2023-02-28 16:20:00, KyotoBambooSeeker , Facebook , #Tranquility #ZenWisdom ,25.0,50.0,"UnknownCity, UnknownState, UnknownCountry",2023,2,28,16
509,509,"Cruising the fjords of Norway, each icy landscape a breathtaking masterpiece of nature's grandeur. ", Grandeur ,2018-05-28 18:30:00, NorwayFjordExplorer , Instagram , #Grandeur #IcyMasterpiece ,22.0,45.0,"UnknownCity, UnknownState, UnknownCountry",2018,5,28,18
510,510,"At the front row of Adele's concert, each note of 'Someone Like You' resonates with soul-stirring emotion. ", Emotion ,2022-09-15 20:00:00, AdeleConcertGoer , Instagram , #Emotion #AdeleConcert ,40.0,80.0,"Los Angeles, California, USA",2022,9,15,20
511,511,"Dancing under the stars at Beyoncé's live show, feeling the power of 'Single Ladies' in every move. ", Energy ,2019-07-28 21:30:00, BeyonceDancer , Twitter , #Energy #BeyonceConcert ,35.0,70.0,"Los Angeles, California, USA",2019,7,28,21
512,512,"In the crowd of a Taylor Swift concert, the lyrics of 'Love Story' create an enchanting fairy tale. ", Enchantment ,2021-05-10 19:45:00, SwiftieDreamer , Facebook , #Enchantment #TaylorSwift ,30.0,60.0,"New York, New York, USA",2021,5,10,19
513,513,"Rocking out to the guitar solos at a Queen tribute concert, a journey back in time with Freddie's spirit. ", Nostalgia ,2018-12-02 22:15:00, QueenTributeFan , Instagram , #Nostalgia #QueenTribute ,22.0,45.0,"Manchester, England, UK",2018,12,2,22
514,514,"Swaying to Ed Sheeran's acoustic melodies, a serene evening filled with 'Perfect' moments. ", Serenity ,2020-08-18 19:00:00, SheeranMelodyLover , Twitter , #Serenity #EdSheeranConcert ,18.0,35.0,"Manchester, England, UK",2020,8,18,19
515,515,"Immersed in the pulsating beats of a Bruno Mars concert, where 'Uptown Funk' becomes a city of joy. ", Joy ,2017-03-28 20:30:00, MarsJoyExplorer , Facebook , #Joy #BrunoMars ,28.0,55.0,"Chicago, Illinois, USA",2017,3,28,20
516,516,"At a Michael Jackson tribute show, moonwalking through the hits, a celebration of the King of Pop. ", Celebration ,2022-01-15 21:15:00, MJTributeDancer , Instagram , #Celebration #MJTribute ,25.0,50.0,"Chicago, Illinois, USA",2022,1,15,21
517,517,"Swinging to the rhythms of a Frank Sinatra tribute, feeling the timeless charm of 'Fly Me to the Moon'. ", Charm ,2019-06-10 18:45:00, SinatraCharmListener , Twitter , #Charm #SinatraTribute ,22.0,45.0,"New York, New York, USA",2019,6,10,18
518,518,"In the mosh pit of a Metallica concert, the thunderous chords create a symphony of headbanging ecstasy. ", Ecstasy ,2023-03-20 22:30:00, MetallicaMoshWarrior , Facebook , #Ecstasy #MetallicaConcert ,35.0,70.0,"New York, New York, USA",2023,3,20,22
519,519,"Experiencing the magic of a Coldplay concert, where 'Fix You' becomes a beacon of hope in the night. ", Hope ,2016-11-28 19:00:00, ColdplayHopeSeeker , Instagram , #Hope #ColdplayMagic ,30.0,60.0,"Birmingham, England, UK",2016,11,28,19
520,520,"At a Justin Bieber concert, the infectious beats of 'Baby' create a dance floor of unbridled enthusiasm. ", Enthusiasm ,2018-08-05 20:00:00, BieberDanceEnthusiast , Instagram , #Enthusiasm #JustinBieber ,40.0,80.0,"Vancouver, British Columbia, Canada",2018,8,5,20
521,521,"In the spotlight at a Lady Gaga show, each costume change is a metamorphosis of creativity and artistry. ", Creativity ,2021-04-15 21:30:00, GagaArtisticChameleon , Twitter , #Creativity #LadyGaga ,35.0,70.0,"New York, New York, USA",2021,4,15,21
522,522,"Immersed in the soulful melodies of Adele, tears flow freely, moved by the emotion of 'Hello'. ", Emotion ,2019-11-28 19:45:00, AdeleMelodyTearjerker , Facebook , #Emotion #AdeleMelodies ,30.0,60.0,"London, England, UK",2019,11,28,19
523,523,"Drenched in confetti at a Katy Perry concert, a kaleidoscope of colors igniting the night sky. ", Colorful ,2020-06-22 22:00:00, KatyPerryColorExplosion , Instagram , #Colorful #KatyPerry ,22.0,45.0,"Chicago, Illinois, USA",2020,6,22,22
524,524,"In the audience of a Jay-Z performance, the lyrics of 'Empire State of Mind' become an anthem of pride. ", Pride ,2017-09-10 20:15:00, JayZEmpireListener , Twitter , #Pride #JayZAnthem ,18.0,35.0,"Chicago, Illinois, USA",2017,9,10,20
525,525,"Dancing to Shakira's rhythmic beats, hips swaying to the hypnotic charm of 'Hips Don't Lie'. ", Hypnotic ,2022-02-28 21:15:00, ShakiraHipsDancer , Facebook , #Hypnotic #ShakiraRhythms ,28.0,55.0,"UnknownCity, UnknownState, UnknownCountry",2022,2,28,21
526,526,"At a U2 concert, the anthemic chords of 'With or Without You' create a timeless moment of connection. ", Connection ,2016-05-15 19:30:00, U2ConnectionSeeker , Instagram , #Connection #U2Anthem ,25.0,50.0,"UnknownCity, UnknownState, UnknownCountry",2016,5,15,19
527,527,"Rocking out at a Guns N' Roses show, the iconic riffs of 'Sweet Child o' Mine' echoing in the night. ", Iconic ,2018-12-10 22:30:00, GunsNRosesRiffRockstar , Twitter , #Iconic #GNRConcert ,22.0,45.0,"Chicago, Illinois, USA",2018,12,10,22
528,528,"In the crowd of an Ariana Grande concert, the high notes of 'Into You' create a euphoric symphony. ", Euphoria ,2023-01-22 20:00:00, ArianaEuphoriaChaser , Facebook , #Euphoria #ArianaGrande ,35.0,70.0,"New York, New York, USA",2023,1,22,20
529,529,"Swaying to the reggae vibes of Bob Marley's tribute concert, each chord a journey to Jamaica's soul. ", Journey ,2020-03-05 18:45:00, MarleyReggaeTraveler , Instagram , #Journey #BobMarleyTribute ,30.0,60.0,"UnknownCity, UnknownState, UnknownCountry",2020,3,5,18
